{
    "schema_version": "backup.v2",
    "job_id": "01JRZX9K2Q4M8N7P6T5V3W2Y1B",
    "manifest_b64": "ewogICAgIm1hbmlmZXN0X3ZlcnNpb24iOiAiYmFja3VwLW1hbmlmZXN0LnYyIiwKICAgICJhcnRpZmFjdF9pZCI6ICIwMUpaWDlLMlE0TThON1A2VDVWM1cyWTFCMCIsCiAgICAic2l0ZV9pZCI6ICIwMUpSWlg5SzJRNE04TjdQNlQ1VjNXMlkxQiIsCiAgICAic2l0ZV9rZXlfZmluZ2VycHJpbnQiOiAiTUdSUy00R05YLTNGRFEtSzJNUi0wQjBTLUVTNkYtTlJQMSIsCiAgICAidGFrZW5fYXQiOiAxNzg1MzQwMDAwLAogICAgInNlcXVlbmNlIjogNDIsCiAgICAiZW5jcnlwdGlvbiI6IHsKICAgICAgICAic2NoZW1lIjogInhjaGFjaGEyMHBvbHkxMzA1LXNlY3JldHN0cmVhbS12MSIsCiAgICAgICAgImNodW5rX2J5dGVzIjogMTA0ODU3NiwKICAgICAgICAic3RyZWFtX2hlYWRlciI6ICJpbTFydmVEZkxObTk4dFFKV2w0SHBVMlgxUEE1ajBJUiIKICAgIH0sCiAgICAia2V5X3dyYXBwaW5nIjogewogICAgICAgICJhbGdvcml0aG0iOiAieDI1NTE5LWNyeXB0b19ib3hfc2VhbC12MSIsCiAgICAgICAgInJlY2lwaWVudHMiOiBbCiAgICAgICAgICAgIHsKICAgICAgICAgICAgICAgICJmaW5nZXJwcmludCI6ICJNR1JLLVZUV0ctTUFCNC1BTVdTLVJFM1otS01INy1BRDVDIiwKICAgICAgICAgICAgICAgICJwdWJsaWNfa2V5IjogIlpJaEdINSthZ1BiNGR3a21LZkhHZTg3Y3FWNHlqTnRXUm93a21FZFRYbUU9IiwKICAgICAgICAgICAgICAgICJ3cmFwcGVkX2tleSI6ICJzOTcvajdBTzZEMm40RFJ2TmxpREhiNnlIVnFUazV3cURxSHZpMnhOazFVaFN6WUVzVENEejBzbEd6NHoxa05hc211bXN6T01iRDN3ejdnNXgxNkU0SFNLb0ZGTnl5NG1oa2xqMStSLytzMD0iLAogICAgICAgICAgICAgICAgImxhYmVsIjogIk9wcyBsYXB0b3AiCiAgICAgICAgICAgIH0sCiAgICAgICAgICAgIHsKICAgICAgICAgICAgICAgICJmaW5nZXJwcmludCI6ICJNR1JLLTEzOVYtRFlNSi0wVE1aLTNNOEItN0UwUS1ORTFGIiwKICAgICAgICAgICAgICAgICJwdWJsaWNfa2V5IjogIjhvVFlvSTN5U0hEQys4RnVIc0UzZGlTQ3JKUWpKT1RDd2F3dXhVRlhsWG89IiwKICAgICAgICAgICAgICAgICJ3cmFwcGVkX2tleSI6ICJid0tzVHVWMDJESFYyOHgvZEFheUIyUXZzbTRpN1AzUjYzeTE4V2VhQ1FoN3NnbTE0c2x4TGMwc0kyMGFIeHZKSmNqZ1NBZzdiZ3YyNzc5cG1INkFvUUZIZ21oYnRvN1FyOWQ2Yi9abnhNbz0iLAogICAgICAgICAgICAgICAgImxhYmVsIjogIlNhZmUiCiAgICAgICAgICAgIH0KICAgICAgICBdCiAgICB9LAogICAgImludGVncml0eSI6IHsKICAgICAgICAicGxhaW50ZXh0X3NoYTI1NiI6ICI1MjBkMjY3M2RmMmZmYWM3OGUzZGRiY2U2YjI3NDZiY2UyNjY3MWU0OTAxY2RjNjVhNjJmZTEwZjA4OWY0NWZjIiwKICAgICAgICAiY2lwaGVydGV4dF9zaGEyNTYiOiAiOGNjYjBkMWUwODgzZDQxZWZlNGQxY2ZhYzE4YzU3YmE1MjUwYTQxM2EyODBkM2NlMDg2NjJlNDQxMTNjMDA4OSIsCiAgICAgICAgInBsYWludGV4dF9ieXRlcyI6IDk2LAogICAgICAgICJjaXBoZXJ0ZXh0X2J5dGVzIjogMTM3CiAgICB9LAogICAgInNvdXJjZSI6IHsKICAgICAgICAiZW5naW5lIjogIm15c3FsIiwKICAgICAgICAiZW5naW5lX3ZlcnNpb24iOiAiOC4wLjM2IiwKICAgICAgICAiY29tcHJlc3NlZCI6IGZhbHNlLAogICAgICAgICJjb21wcmVzc2lvbiI6ICJub25lIgogICAgfQp9",
    "manifest_sha256": "7809dede8ba3713a36ca4b184238e509299b4a0a955d5ddb95a3bcf797c400dd",
    "manifest_signature": "6vz1oKem5s2y+sjliOmXEVXE/6cTLyyXQr4gnINSZdyJKmIVz14LHaw02URxQJg95hH4EejorPfEhT+HmHNSBg==",
    "artifact_sha256": "a5a97fc1c3bc9ff6f2c4249b6dd9c42924ea432f40c7d8f5b7046d77dd10f722",
    "artifact_bytes": 1892,
    "upload_mode": "platform"
}
